{
  "schema_version": "1.1",
  "engine": "semantics",
  "page_id": "example-1-6",
  "paragraphs": [
    {
      "paragraph_id": "p09",
      "lessons": [
        {
          "key": "ortak-n-farkli-kok",
          "concepts": [
            {
              "id": "ML:C016",
              "role": "teaches"
            },
            {
              "id": "ML:C024",
              "role": "teaches"
            },
            {
              "id": "ML:C092",
              "role": "reinforces"
            }
          ],
          "level": 1,
          "sentences_tr": [
            "Naʿbüdü ile nestaʿîn aynı n- sesiyle başlasa da kökleri farklıdır. Bu ortak başlangıç, bu iki çekimde “biz” kişisini gösterir; kelime akrabalığını kanıtlamaz."
          ],
          "anchors": [
            {
              "source_ref": "Quran:1:5",
              "arabic": "إِيَّاكَ نَعْبُدُ وَإِيَّاكَ نَسْتَعِينُ",
              "reading_tr": "iyyâke naʿbüdü ve iyyâke nestaʿîn"
            }
          ],
          "evidence_refs": [
            "QAC:1:5:2:1",
            "QAC:1:5:4:1",
            "Construction:1:6"
          ],
          "reminder_ids": []
        }
      ],
      "deferred": []
    },
    {
      "paragraph_id": "p12",
      "lessons": [
        {
          "key": "yol-ve-duz-yol",
          "concepts": [
            {
              "id": "ML:C247",
              "role": "teaches"
            },
            {
              "id": "ML:C255",
              "role": "teaches"
            }
          ],
          "level": 1,
          "sentences_tr": [
            "Sözlük bu dalda “yol” anlamını temel alır, “düz yol” yönünü de özellikle belirtir. Bu yüzden düzlük, kelimenin her kullanımına zorunlu olarak yüklenmemelidir."
          ],
          "anchors": [
            {
              "source_ref": "Quran:1:6",
              "arabic": "ٱلصِّرَٰطَ",
              "reading_tr": "es-sırâta",
              "word_ref": "1:6:2",
              "reading_note_tr": "Bu örnekte sonraki sıfata bağlanarak okunur."
            }
          ],
          "evidence_refs": [
            "Dictionary:root_000858/B001#identity_judgment",
            "Dictionary:root_000858/B001#concept_map"
          ],
          "reminder_ids": [],
          "branch_refs": [
            "root_000858/B001"
          ]
        },
        {
          "key": "soyleyis-ve-anlam",
          "concepts": [
            {
              "id": "ML:C298",
              "role": "teaches"
            }
          ],
          "level": 1,
          "sentences_tr": [
            "Sözlük, sırât, sirât ve zırât söyleyişlerini aynı yol anlamı altında kaydeder. Ses farkı tek başına her birine ayrı bir anlam vermeyi gerektirmez."
          ],
          "anchors": [
            {
              "source_ref": "Quran:1:6",
              "arabic": "ٱلصِّرَٰطَ",
              "reading_tr": "es-sırâta",
              "word_ref": "1:6:2",
              "reading_note_tr": "Bu örnekte sonraki sıfata bağlanarak okunur."
            }
          ],
          "evidence_refs": [
            "Dictionary:root_000858/B001#what_is_ar",
            "Dictionary:root_000858/B001#source_phrase_ar"
          ],
          "reminder_ids": [],
          "branch_refs": [
            "root_000858/B001"
          ]
        }
      ],
      "deferred": []
    }
  ]
}
